Category,Question,Answer
Transportation,What is the public transportation system like in Berlin?,"Berlin has an extensive and well-developed public transportation system that offers various options for getting around the city. Here's an overview of the public transportation system in Berlin:

1. Berlin U-Bahn: The U-Bahn is the underground metro system in Berlin. It consists of several lines (U1 to U9) that cover the city and provide fast and efficient transportation. The U-Bahn operates from early morning until midnight, and some lines offer 24-hour service on weekends.

2. Berlin S-Bahn: The S-Bahn is the urban commuter train system in Berlin. It connects the city center with the surrounding areas, including suburbs and neighboring cities. The S-Bahn lines are designated with the letter ""S"" followed by a number.

3. Trams: Trams, also known as streetcars, are a popular mode of transportation in Berlin. The tram network covers various parts of the city, including both central and suburban areas. Trams are particularly useful for traveling within neighborhoods and areas not directly served by the U-Bahn or S-Bahn.

4. Buses: Berlin has an extensive bus network that complements the U-Bahn, S-Bahn, and tram services. Buses cover the entire city and provide additional transportation options, especially in areas with limited or no rail connections. Night buses (N lines) operate during the night when other services are reduced or not available.

5. Ferries: Berlin is known for its numerous lakes and waterways, and ferries provide a unique mode of transportation in certain areas. Ferries operate on the Spree River and connect different parts of the city, offering scenic routes and alternative transportation options.

6. Tickets and Fares: To use public transportation in Berlin, you need a valid ticket. The fare system is based on zones, and the ticket prices depend on the number of zones you travel through. Berlin has an integrated fare system, which means that a single ticket is valid for multiple modes of transportation (e.g., U-Bahn, S-Bahn, tram, and bus) within the specified time limit.

7. Ticket Validation: It's important to validate your ticket before starting your journey. Tickets can be validated using the validation machines available on platforms or inside buses and trams. Failure to validate your ticket may result in a fine if checked by ticket inspectors.

8. Timetables and Maps: Timetables and route maps are available at stations, on platforms, and online. These resources provide information on schedules, connections, and the best routes to reach your destination.

9. Accessibility: Berlin's public transportation system is designed to be accessible for people with disabilities. Many stations and vehicles are equipped with facilities such as elevators, ramps, and designated spaces for wheelchair users.

10. Bike Sharing: Berlin has bike-sharing systems that allow you to rent bicycles for short trips. These bikes can be easily rented and returned at designated stations throughout the city.

Overall, Berlin's public transportation system offers a convenient and efficient way to navigate the city, with extensive coverage and various options to suit different travel needs."
Healthcare,How does healthcare in Germany work?,"Germany has a well-regarded healthcare system that provides comprehensive coverage to its residents. Here's an overview of how healthcare works in Germany:

1. Statutory Health Insurance (Gesetzliche Krankenversicherung): The majority of residents in Germany are covered by statutory health insurance, also known as public health insurance. It is a mandatory system that offers basic healthcare coverage to individuals and their dependents. Contributions to health insurance are shared between employees and employers based on income.

2. Private Health Insurance (Private Krankenversicherung): Private health insurance is an alternative to statutory health insurance and is available to certain groups, such as self-employed individuals, high-income earners, and certain professionals. Private health insurance offers more flexibility and additional benefits but may have higher premiums.

3. Coverage and Benefits: The German healthcare system provides comprehensive coverage for a wide range of medical services, including doctor visits, hospital stays, prescription medications, preventive care, and maternity care. The coverage extends to both acute and chronic conditions.

4. Choice of Doctors and Specialists: Patients in Germany have the freedom to choose their primary care doctors (Hausarzt) and specialists directly without the need for a referral. This allows individuals to have greater control over their healthcare decisions.

5. Co-payments: While most medical services are covered by health insurance, patients may be required to make small co-payments for certain treatments, medications, or medical aids. These co-payments are typically a percentage of the cost and are capped to prevent excessive financial burden.

6. Waiting Times: The German healthcare system is known for its relatively short waiting times for medical treatments and procedures. However, the waiting times can vary depending on the demand and urgency of the medical condition.

7. Pharmacies and Medications: Pharmacies in Germany play a crucial role in providing medications. Prescription medications can be obtained from pharmacies, and patients are usually responsible for a small co-payment. Over-the-counter medications and other health-related products are also available at pharmacies.

8. Electronic Health Card (elektronische Gesundheitskarte): The electronic health card is a personalized card issued to individuals covered by statutory health insurance. It stores essential health information and facilitates smooth communication between healthcare providers.

9. Long-Term Care Insurance: Germany has a separate long-term care insurance system (Pflegeversicherung) to cover long-term care needs, such as nursing care and assistance for individuals with chronic illnesses or disabilities. Contributions to long-term care insurance are also shared between employees and employers.

10. Quality and Standards: The German healthcare system maintains high standards of quality and safety. Healthcare providers must meet specific criteria and adhere to regulations to ensure patient safety and effective treatment.

It's important to note that healthcare in Germany is constantly evolving, and specific details may vary. For accurate and up-to-date information, it's advisable to consult official sources or healthcare professionals in Germany."
Healthcare,Are there any additional health insurance options in Germany?,"In addition to statutory health insurance and private health insurance, there are a few additional health insurance options available in Germany. Here are some examples:

1. Supplementary Health Insurance (Zusatzversicherung): Supplementary health insurance allows individuals to enhance their existing health insurance coverage by adding additional benefits and services. These may include coverage for alternative medicine, dental care, private hospital rooms, or additional treatments not covered by standard health insurance.

2. Travel Health Insurance (Reisekrankenversicherung): Travel health insurance provides coverage for medical expenses during trips abroad. It can be useful for individuals visiting Germany or German residents traveling outside the country. Travel health insurance typically covers emergency medical treatment, repatriation, and other related costs.

3. Dental Insurance (Zahnzusatzversicherung): Dental insurance provides coverage specifically for dental treatments and procedures. It can help offset the costs of routine dental care, orthodontics, or more extensive dental work.

4. Accident Insurance (Unfallversicherung): Accident insurance provides financial protection in the event of an accident resulting in injury or disability. It may cover medical expenses, rehabilitation costs, and disability benefits.

5. Critical Illness Insurance (Schwere-Krankheiten-Versicherung): Critical illness insurance offers coverage for specific serious illnesses, such as cancer, heart disease, or stroke. It provides a lump sum payment upon diagnosis of a covered illness, which can be used to cover medical expenses or other financial needs.

6. International Health Insurance (Internationale Krankenversicherung): International health insurance is designed for individuals who require coverage both in Germany and in other countries. It offers a more comprehensive level of health insurance for international travelers or individuals with a global lifestyle.

7. Professional Association Health Insurance (Berufsgenossenschaftliche Krankenversicherung): Certain professional groups, such as artists, farmers, or public servants, may have specialized health insurance options through professional associations or organizations.

It's important to carefully review the terms, coverage, and costs associated with additional health insurance options to determine their suitability for individual needs. Consulting with insurance providers or insurance brokers can provide more detailed information on the available options."
Education,What is the education system like in Germany?,"The education system in Germany is known for its high quality and strong emphasis on academic and vocational training. Here are some key features of the education system:

1. Early Education (Kindergarten): Early education is not compulsory in Germany but is widely available. Children usually attend kindergarten from the age of three until they start primary school.

2. Primary Education (Grundschule): Primary education in Germany typically lasts for four years, from grades 1 to 4. Students receive a broad education covering subjects such as mathematics, German language, social studies, natural sciences, and physical education.

3. Secondary Education (Sekundarstufe I): After completing primary education, students move on to secondary education, which is divided into two phases: lower secondary (grades 5 to 9 or 10) and upper secondary (grades 10 or 11 to 12 or 13). Lower secondary education focuses on core subjects and offers a range of elective courses.

4. Secondary School Tracks: At the end of lower secondary education, students are typically placed into one of several secondary school tracks based on their academic performance and career goals. These tracks include Gymnasium (college-preparatory school), Realschule (intermediate school), and Hauptschule (vocational-oriented school).

5. Vocational Education and Training (Berufsschule): Vocational education and training (VET) programs are available for students who opt for a more hands-on and practical approach to learning. VET combines classroom instruction with on-the-job training and typically leads to recognized vocational qualifications.

6. Upper Secondary Education (Sekundarstufe II): Upper secondary education comprises grades 10 or 11 to 12 or 13, depending on the school track. Gymnasium students can continue to pursue the Abitur, a qualification that grants access to higher education.

7. Tertiary Education: Tertiary education in Germany includes universities, technical universities, and colleges of art, music, and film. Bachelor's, master's, and doctoral degrees are offered across various disciplines.

8. Dual Education System: Germany is known for its dual education system, which combines vocational training in a company with classroom-based learning. This system allows students to acquire practical skills while earning a salary.

9. International Schools: Germany also has a range of international schools that cater to the needs of expatriate and international students. These schools often follow international curricula and offer instruction in multiple languages.

The education system in Germany is highly regarded globally, and it places a strong emphasis on providing students with a well-rounded education and preparing them for future careers or higher education opportunities."
Education,What is the grading system in German schools and universities?,"The grading system in German schools and universities typically follows a scale from 1 to 6, with 1 being the highest and 6 being the lowest. Here is a breakdown of the grading system:

1 (Sehr Gut): Excellent (90-100%)
2 (Gut): Good (80-89%)
3 (Befriedigend): Satisfactory (70-79%)
4 (Ausreichend): Sufficient (60-69%)
5 (Mangelhaft): Poor/Fail (50-59%)
6 (Ungenügend): Very Poor/Fail (below 50%)

Grades may also be represented using a point system, with 15 points equivalent to a grade of 1 and 0 points for a grade of 6. The grading scale may vary slightly depending on the educational institution and the specific course or subject.

At universities, grades are often given in the form of percentages or grade points. The grading scale and point system used at universities can vary, so it's important to refer to the specific institution's guidelines or grading regulations for accurate information.

Additionally, a distinction is made between pass/fail grades and grades used to calculate the overall grade point average (GPA). The GPA is typically calculated based on the credit hours and grades earned in individual courses throughout a degree program.

It's important to note that grading practices may differ between schools and universities, so it's advisable to refer to the institution's guidelines or consult with professors or academic advisors for specific information regarding grading."
Education,What are the options for higher education in Germany?,"Germany offers a wide range of options for higher education, including universities, technical universities, colleges of art, music, and film, universities of applied sciences, dual universities, research institutes and graduate schools, and distance learning universities. Here's a breakdown of the main types of higher education institutions in Germany:

1. Universities (Universitäten): Universities in Germany provide a comprehensive range of academic disciplines and research-oriented programs. They offer bachelor's, master's, and doctoral degrees across various fields of study.

2. Technical Universities (Technische Universitäten): Technical universities specialize in engineering, science, and technology-related fields. They offer programs in subjects such as engineering, computer science, natural sciences, and architecture.

3. Colleges of Art, Music, and Film (Kunsthochschulen, Musikhochschulen, Filmhochschulen): These institutions focus on artistic and creative disciplines, including fine arts, music, design, theater, dance, and film. They provide specialized training and education in their respective fields.

4. Universities of Applied Sciences (Fachhochschulen): Universities of Applied Sciences offer practice-oriented degree programs in areas such as engineering, business administration, social work, media, and applied sciences. They often have strong ties to the industry and emphasize practical training and internships.

5. Dual Universities (Duale Hochschulen): Dual universities follow the dual education system and combine academic studies with on-the-job training. Students alternate between classroom instruction and practical work experience in partner companies.

6. Research Institutes and Graduate Schools: Germany is home to numerous research institutes and graduate schools that focus on specific fields of study or interdisciplinary research. These institutions provide advanced research opportunities and often offer doctoral programs.

7. Distance Learning Universities: Germany also has distance learning universities that provide flexible study options for individuals who cannot attend traditional on-campus programs. These universities offer online courses and degree programs that can be pursued remotely.

When choosing a higher education institution in Germany, it's important to consider your academic interests, career goals, and the reputation of the program. Each type of institution has its own strengths and characteristics, so researching their websites, admission requirements, and course offerings will help you find the best fit for your educational journey."
Healthcare and Insurance,What are the healthcare and insurance systems like in Germany?,"Germany has a comprehensive healthcare system that ensures high-quality medical care for its residents. Here are the key features of the healthcare and insurance systems in Germany:

1. Statutory Health Insurance (Gesetzliche Krankenversicherung, GKV): Statutory health insurance is mandatory for most residents in Germany. It covers a broad range of medical services, including doctor visits, hospital stays, medications, and preventive care. Contributions to statutory health insurance are based on a percentage of income and are typically shared between the employee and the employer.

2. Private Health Insurance (Private Krankenversicherung, PKV): Private health insurance is available as an alternative to statutory health insurance. It is commonly chosen by self-employed individuals, high-income earners, and certain professional groups. Private health insurance offers more extensive coverage but comes with higher premiums and eligibility requirements.

3. Healthcare Providers: Germany has a network of healthcare providers that includes general practitioners (Hausarzt), specialists, hospitals, and clinics. Patients usually begin with a visit to their general practitioner, who can refer them to specialists if necessary.

4. Co-Payments: Patients in Germany are responsible for co-payments known as Zuzahlungen. These co-payments are usually a percentage of the medical costs and apply to certain services and medications.

5. Medical Emergency Services: In case of medical emergencies, Germany has well-developed emergency medical services (Notarzt) and a nationwide emergency number (112). Hospitals have emergency departments that operate 24/7 to provide immediate care.

6. Prescription Medication: Prescription medication in Germany is generally covered by health insurance. Patients typically pay a portion of the medication cost as a co-payment.

7. Long-Term Care Insurance: Germany has a mandatory long-term care insurance system (Pflegeversicherung) that provides coverage for long-term care services for individuals who require assistance with daily activities due to illness, disability, or old age.

8. International Health Insurance: Non-EU citizens without a work visa and certain other individuals who are not eligible for statutory health insurance may need to obtain international health insurance to meet visa requirements and ensure access to healthcare services.

It's important to note that specific details and regulations may vary, so it's advisable to consult health insurance providers, healthcare professionals, or the local health authority for detailed information regarding healthcare and insurance systems in Germany."
Education,What are the requirements for international students to study in Germany?,"International students interested in studying in Germany must fulfill certain requirements to be eligible for admission to a German university. Here are the main requirements for international students:

1. Higher Education Entrance Qualification: International students must have an equivalent qualification to the German higher education entrance qualification (Abitur) to be eligible for admission to a bachelor's degree program. The specific requirements vary depending on the country and educational system.

2. Language Proficiency: Proficiency in the German language is essential for most undergraduate programs taught in German. International students are generally required to provide proof of their German language skills by taking recognized language proficiency tests such as TestDaF or DSH. Some universities may offer preparatory language courses for international students.

3. English Language Proficiency: If applying to an English-taught program, international students must provide proof of English language proficiency through recognized tests such as TOEFL or IELTS. The specific score requirements may vary depending on the university and program.

4. Application Process: International students must submit their applications through the university's online application portal or the national application platform, Uni-Assist. The application process typically involves submitting academic transcripts, a motivation letter, a CV, and letters of recommendation. Some programs may require additional documents, such as a portfolio for artistic disciplines.

5. Financial Resources: International students are required to demonstrate sufficient financial resources to cover their living expenses in Germany. This can be done by providing bank statements, scholarship award letters, or other proof of financial support.

6. Health Insurance: International students must have health insurance coverage that meets the German requirements. This can be either statutory health insurance or private health insurance.

7. Visa Requirements: Non-EU/EEA international students are generally required to obtain a student visa to study in Germany. The visa application process includes providing proof of admission to a German university, proof of financial resources, health insurance coverage, and a valid passport.

It's important to note that the requirements may vary depending on the university, program, and country of origin. It's advisable to consult the official website of the respective university and the German diplomatic mission in your home country for detailed and up-to-date information regarding the requirements for international students to study in Germany."
Education,What are the available scholarships for international students to study in Germany?,"Germany offers various scholarships and funding opportunities for international students to support their studies. Here are some of the available scholarships:

1. DAAD Scholarships: The German Academic Exchange Service (DAAD) provides a wide range of scholarships for international students. These scholarships include the DAAD Scholarship for Postgraduate Studies, the DAAD Master's Scholarships for Public Policy and Good Governance, the DAAD Helmut-Schmidt-Programme (Master’s Scholarships for Public Policy and Good Governance), and many others. These scholarships cover tuition fees, monthly stipends, travel allowances, and health insurance.

2. Deutschlandstipendium: The Deutschlandstipendium is a merit-based scholarship that provides financial support to both domestic and international students. It is funded by the German government, private organizations, and companies. The scholarship amount is €300 per month and is awarded for at least one year.

3. Erasmus+ Scholarships: Erasmus+ is a European Union (EU) program that offers scholarships and study opportunities for students across Europe, including Germany. It supports mobility programs such as student exchanges, internships, and joint degree programs.

4. Heinrich Böll Foundation Scholarships: The Heinrich Böll Foundation offers scholarships for international students pursuing a master's or doctoral degree in Germany. These scholarships are awarded based on academic excellence and commitment to social and environmental issues.

5. Konrad-Adenauer-Stiftung Scholarships: The Konrad-Adenauer-Stiftung provides scholarships to international students who demonstrate strong leadership potential and a commitment to democracy, the rule of law, and social market economy.

6. Friedrich Ebert Foundation Scholarships: The Friedrich Ebert Foundation offers scholarships for talented international students who show a commitment to social democracy and social justice.

7. Study-specific Scholarships: Many universities and colleges in Germany offer study-specific scholarships for international students. These scholarships are often discipline-specific and are awarded based on academic achievements and other criteria.

8. Government Scholarships: Some countries offer government-sponsored scholarships for their citizens to study in Germany. Examples include the Chevening Scholarships (United Kingdom), Fulbright Scholarships (United States), and many others.

9. Corporate and Foundation Scholarships: Various corporations, foundations, and organizations in Germany offer scholarships for international students. These scholarships are often industry-specific or target students from specific countries or regions.

It's important to research and explore all available scholarship opportunities, as each scholarship has specific eligibility criteria and application procedures. Additionally, it's advisable to check with the respective university's international office for information on institutional scholarships and funding options."
