Category,Question,Answer
Visa Procedure,What are the different types of visas available for Germany?,"""Germany offers various types of visas based on the purpose of your visit. Some common visa types include: Schengen Visa - This visa allows short-term stays in Germany and other Schengen member countries for tourism, business, or medical purposes. Student Visa - For individuals planning to study in Germany at a recognized educational institution. Work Visa - Required for non-EU citizens intending to work in Germany. The visa type may vary based on employment circumstances, such as job seekers, skilled workers, or EU Blue Card holders. Job Seeker Visa - Allows individuals to enter Germany for a limited period to search for employment opportunities. Family Reunion Visa - For family members joining their relatives who are already living in Germany. Business Visa - For individuals attending meetings, conferences, or conducting business activities in Germany. Freelancer Visa - For self-employed individuals planning to work as freelancers or start their own business. Artist Visa - Specifically for artists, musicians, and performers coming to Germany for cultural or artistic purposes. Medical Treatment Visa - Required for individuals seeking medical treatment or undergoing medical procedures in Germany. Au Pair Visa - For young individuals participating in the Au Pair program and living with a German host family. These are just a few examples, and there may be other visa types depending on specific circumstances. It's important to check the official websites of the German diplomatic missions in your home country for detailed information on visa requirements and application procedures."""
Visa Procedure,What is the process of applying for a student visa in Germany?,"""The process of applying for a student visa in Germany typically involves the following steps: Admission to a German university - Get accepted into a recognized German university or educational institution and receive the admission letter. Gather required documents - Prepare the necessary documents for the visa application, which may include a valid passport, passport-sized photographs, proof of financial resources, health insurance, admission letter, and educational certificates. Make an appointment - Schedule an appointment with the German embassy or consulate in your home country to submit your visa application. Complete the application form - Fill out the student visa application form accurately and provide all the required information. Attend the visa interview - Visit the German embassy or consulate for the visa interview. Be prepared to answer questions about your study plans, financial resources, and motivation for studying in Germany. Pay the visa fee - Pay the required visa processing fee, which may vary depending on your home country. Wait for the visa decision - After submitting your application and attending the interview, wait for the visa decision. The processing time may vary, so it's advisable to apply well in advance. Travel to Germany - If your student visa is approved, make travel arrangements to Germany and ensure that you fulfill any additional requirements, such as registering with the local authorities. It's important to consult the official website of the German embassy or consulate in your home country for detailed instructions and specific requirements for the student visa application."""
Visa Procedure,Can I work while studying with a student visa in Germany?,"""Yes, it is possible to work while studying in Germany with a student visa, but there are certain restrictions and conditions. Here are some key points to consider: Work hour limitations - As an international student, you are allowed to work part-time for up to 120 full days or 240 half days in a year without obtaining a separate work permit. Student job restrictions - Student visa holders are generally permitted to take on student jobs or part-time positions that are not highly qualified or related to their field of study. These jobs are often in sectors such as hospitality, retail, or administrative roles. Internships - If an internship is a mandatory part of your study program, you can undertake it without additional work permits. However, if the internship is not a compulsory part of your curriculum, you may need a work permit to engage in it. Work during semester breaks - During semester breaks or holidays, there are no restrictions on working hours or types of employment. Work after graduation - After completing your studies, you may be eligible to extend your residence permit for up to 18 months to search for job opportunities in Germany. If you secure employment relevant to your field of study, you can apply for a work permit or a Blue Card. German language proficiency - Proficiency in the German language is often required for jobs outside of the academic realm. Having a good command of the German language can enhance your employment prospects. It's important to note that working part-time should not hinder your academic progress, as your primary focus should be on your studies. It's advisable to check with the respective university or the local Foreigners' Office for specific regulations and guidelines related to working while studying with a student visa."""
Visa Procedure,What are the requirements for a work visa in Germany?,"""The specific requirements for a work visa in Germany may vary based on the type of work and individual circumstances. However, here are some general requirements: Job offer - You must have a confirmed job offer or employment contract from a German employer. The job should meet certain criteria, such as being in line with the local labor market conditions and offering sufficient salary. Vocational qualifications - Depending on the nature of the job, you may need to provide evidence of relevant vocational qualifications, certifications, or degrees. Health insurance - It is mandatory to have health insurance coverage that meets the German requirements. This can be public or private health insurance. Financial resources - You must demonstrate that you have sufficient financial resources to support yourself during your stay in Germany. This may include bank statements, employment contracts, or sponsorship letters. Valid passport - Your passport should be valid for the intended duration of your stay in Germany. Language proficiency - Depending on the job requirements and the employer's preferences, you may need to demonstrate a certain level of proficiency in the German language. Work permit - In some cases, a work permit may be required in addition to the work visa. The work permit is usually obtained by the employer on behalf of the employee. Qualification recognition - If your profession is regulated in Germany, you may need to have your foreign qualifications recognized by the relevant authorities in Germany. Background checks - The German authorities may conduct background checks, including criminal record checks, as part of the visa application process. It's important to note that the requirements can vary depending on the specific circumstances, such as the country of origin and the type of work. It's recommended to consult the German embassy or consulate in your home country for detailed information and guidance on the work visa requirements."""
Visa Procedure,What are the requirements for a Blue Card in Germany?,"""The Blue Card is a work and residence permit designed for highly skilled non-EU citizens seeking employment in Germany. The requirements for obtaining a Blue Card include:

- Employment offer: You must have a binding job offer or employment contract from a German employer that meets specific criteria, such as offering a salary above a certain threshold.
- Qualifications: You should hold a recognized university degree or an equivalent qualification that is relevant to your intended employment in Germany.
- Salary threshold: The minimum salary requirement for the Blue Card is usually higher than for other work permits. The specific threshold is subject to change and may depend on the occupation or local labor market conditions.
- Labor market approval: In some cases, the German Federal Employment Agency must grant approval for your employment in terms of local labor market conditions.
- Health insurance: It is mandatory to have health insurance coverage that meets the German requirements. This can be public or private health insurance.
- Valid passport: Your passport should be valid for the intended duration of your stay in Germany.
- Language proficiency: While not a mandatory requirement for the Blue Card, having a good command of the German language can be beneficial for your integration into the German society and job market.
- Background checks: The German authorities may conduct background checks, including criminal record checks, as part of the Blue Card application process.
- Qualification recognition: If your profession is regulated in Germany, you may need to have your foreign qualifications recognized by the relevant authorities in Germany.
- Proof of financial resources: You may be required to demonstrate sufficient financial resources to support yourself during your stay in Germany.

It's important to consult the official website of the German embassy or consulate in your home country for the most up-to-date and detailed information on the Blue Card requirements and application process."""
Visa Procedure,What is the process of applying for a job seeker visa in Germany?,"""The process of applying for a job seeker visa in Germany typically involves the following steps:

1. Gather required documents: Collect the necessary documents for the visa application, which may include a valid passport, passport-sized photographs, educational certificates, curriculum vitae (CV), proof of financial resources, and health insurance.

2. Research and preparation: Conduct thorough research on job opportunities in Germany, including the job market, industries, and companies relevant to your field of expertise. Prepare a targeted CV and cover letter tailored to the German job market.

3. Make an appointment: Schedule an appointment with the German embassy or consulate in your home country to submit your visa application.

4. Complete the application form: Fill out the job seeker visa application form accurately and provide all the required information.

5. Attend the visa interview: Visit the German embassy or consulate for the visa interview. Be prepared to discuss your qualifications, job search plan, and motivation for finding employment in Germany.

6. Pay the visa fee: Pay the required visa processing fee, which may vary depending on your home country.

7. Wait for the visa decision: After submitting your application and attending the interview, wait for the visa decision. The processing time may vary, so it's advisable to apply well in advance.

8. Travel to Germany: If your job seeker visa is approved, make travel arrangements to Germany and start your job search. Upon finding employment, you can apply for a work visa or a Blue Card.

It's important to consult the official website of the German embassy or consulate in your home country for detailed instructions and specific requirements for the job seeker visa application."""
Living Costs,What are the average living costs in Germany?,"""The average living costs in Germany can vary depending on the city or region you reside in. However, here are approximate average monthly expenses for a single person:

1. Accommodation: Rent for a one-bedroom apartment can range from €400 to €900, depending on the location. Shared accommodation or student dormitories may offer lower costs.

2. Utilities: The cost of utilities (electricity, heating, water) can range from €100 to €250 per month, depending on the size of the apartment and individual usage.

3. Health insurance: Health insurance premiums for public health insurance typically start from around €100 per month, but the exact cost depends on various factors such as age, income, and insurance provider.

4. Food and groceries: Monthly expenses for food and groceries can range from €150 to €300, depending on personal preferences, cooking habits, and shopping choices.

5. Transportation: Public transportation costs vary by city but generally range from €60 to €100 per month for a monthly pass. Additional expenses may include occasional taxi rides or intercity travel.

6. Communication: Mobile phone plans can cost around €20 to €40 per month, depending on the provider and included services.

7. Internet and TV: Internet and TV packages can range from €30 to €50 per month, depending on the speed, provider, and additional services.

8. Leisure and entertainment: Expenses for leisure activities, dining out, cultural events, and entertainment can vary greatly based on personal preferences. A rough estimate would be around €100 to €200 per month.

It's important to note that these are average estimates, and actual expenses may vary depending on individual lifestyles, cities, and personal choices. Additionally, costs may be higher for families or individuals with specific needs or preferences.

Other potential expenses to consider:

- Education expenses: If you are pursuing higher education in Germany, there may be additional costs such as tuition fees, study materials, and student organization fees. Tuition fees vary depending on the university and the degree program.

- Clothing and personal care: Expenses for clothing and personal care products can vary based on individual preferences and shopping habits. On average, budgeting around €50 to €100 per month for clothing and personal care can be reasonable.

- Gym or fitness membership: If you are interested in maintaining an active lifestyle and joining a gym or fitness center, monthly membership fees can range from €20 to €50, depending on the facility and location.

- Travel and vacations: Setting aside a portion of your budget for travel and vacations can be a great way to explore Germany and nearby European countries. The costs will depend on the destination, duration, and travel style.

- Insurance: Apart from health insurance, you may also need to consider other types of insurance, such as liability insurance or household insurance. The costs will vary depending on the coverage and insurance provider.

- Hobbies and recreational activities: Expenses related to hobbies, sports clubs, memberships, and recreational activities like cinema tickets or museum visits can add up. Allocate a portion of your budget for these activities based on your interests.

- Taxes: Depending on your employment status and income level, you may be subject to income taxes. It's advisable to consult with a tax professional or the local tax authority to understand your tax obligations.

- Miscellaneous expenses: It's always a good idea to have some extra funds for unforeseen expenses or miscellaneous items like household items, repairs, or personal emergencies.

- Saving and investments: Consider allocating a portion of your monthly budget for savings and investments to secure your financial future and meet long-term goals.

Remember, these are general estimates, and individual circumstances may vary. It's important to create a personalized budget based on your specific needs, income, and lifestyle choices. Regularly reviewing and adjusting your budget can help you stay financially balanced and

 achieve your financial goals."""
Transportation,What are the main modes of transportation in Germany?,"Germany has a well-developed transportation system that offers various modes of transportation. Here are the main ones:

1. Public Transportation: Germany has an extensive network of buses, trams, and trains that provide efficient and reliable public transportation services. Cities have their own local transportation systems, while the national railway operator, Deutsche Bahn, operates regional and long-distance train services.

2. Trains: Trains are a popular mode of transportation for both short and long-distance travel in Germany. The InterCity (IC) and InterCity Express (ICE) trains connect major cities and offer high-speed travel. Regional trains provide connections to smaller towns and rural areas.

3. Buses: Buses are commonly used for local transportation within cities and for regional travel between towns. They provide an affordable and convenient option for shorter distances.

4. Trams: Trams, also known as streetcars, are common in larger cities and offer transportation within the city limits. They provide a convenient way to move around and explore different neighborhoods.

5. U-Bahn and S-Bahn: U-Bahn (subway) and S-Bahn (urban commuter train) systems are available in major cities like Berlin, Munich, Hamburg, and Frankfurt. They offer rapid transit services within the city and its surrounding areas.

6. Taxis: Taxis are readily available in cities and can be hailed on the street or booked through mobile apps. They are more expensive than public transportation but offer a convenient door-to-door service.

7. Cycling: Germany has an extensive network of cycling paths and is known for its bicycle-friendly infrastructure. Cycling is a popular mode of transportation, especially in cities, and many people use bicycles for commuting and leisure activities.

8. Car Rental: Renting a car is an option for traveling in Germany, especially if you plan to explore rural areas or smaller towns. There are numerous car rental companies available, both at airports and in city centers.

9. Air Travel: For long-distance travel or international connections, Germany has several major airports, including Frankfurt, Munich, Berlin, Hamburg, and Düsseldorf. Domestic flights are available for traveling between different regions of the country.

It's important to note that the availability and efficiency of transportation options may vary depending on the location and size of the city or region in Germany."
Transportation,What is the process of getting a driver's license in Germany?,"The process of obtaining a driver's license in Germany involves several steps. Here's an overview of the process:

1. Theory Exam: Start by studying the German traffic rules and regulations. Enroll in a driving school (Fahrschule) and attend theory classes. Once you feel prepared, take the theory exam (written test) at the local driver's license authority (Führerscheinstelle). The exam includes multiple-choice questions on traffic laws, signs, and safe driving practices.

2. First Aid Course: Before you can take the practical driving lessons, you are required to complete a first aid course (Erste Hilfe Kurs). This course provides basic training in providing first aid in case of emergencies.

3. Vision Test: Visit an eye doctor to get your vision tested and obtain a vision certificate (Sehtestbescheinigung). Good eyesight is crucial for driving safely, and this certificate is a prerequisite for the driver's license application.

4. Practical Lessons: Attend practical driving lessons at a licensed driving school. The number of lessons required may vary depending on your skills and the driving instructor's assessment. The lessons cover different aspects of driving, including maneuvering, traffic rules, and defensive driving techniques.

5. Practical Exam: Once your driving instructor believes you are ready, schedule the practical driving exam (Fahrprüfung) with the local driver's license authority. The exam typically includes driving in various traffic situations and demonstrating your ability to handle the vehicle safely.

6. Provisional License: If you pass the practical exam, you will receive a provisional driver's license (Führerschein auf Probe). This license is valid for two to three years, during which you are considered a novice driver with certain restrictions, such as a lower alcohol limit and limitations on carrying passengers.

7. Full License: After successfully completing the provisional license period without any major traffic offenses, you can apply for the full driver's license (unbeschränkte Fahrerlaubnis). This allows you to drive without any restrictions.

It's important to note that the process may vary slightly depending on the state (Bundesland) in Germany. It's advisable to contact the local driver's license authority or a driving school for specific requirements and detailed information."
Transportation,What are the traffic rules and regulations in Germany?,"Germany has specific traffic rules and regulations that drivers must follow to ensure safety on the roads. Here are some key traffic rules and regulations in Germany:

1. Speed Limits: Speed limits vary depending on the type of road and the location. In urban areas, the speed limit is generally 50 km/h (31 mph), unless otherwise indicated. On rural roads, the speed limit is usually 100 km/h (62 mph), while on autobahns (freeways), certain sections have no specific speed limit. However, it is important to drive at a safe and appropriate speed according to the road conditions.

2. Right-of-Way: The general rule is to yield to vehicles coming from the right unless there are specific signs indicating otherwise. At intersections without traffic signs or signals, the vehicle on the right has the right-of-way.

3. Traffic Signals: Adhere to traffic signals and signs, including traffic lights, stop signs, yield signs, and priority signs. Red means stop, yellow means prepare to stop, and green means go. Follow the instructions indicated by the traffic signals.

4. Seat Belts: It is mandatory for all occupants of a vehicle to wear seat belts, including the driver and passengers in the front and back seats. Children must be secured in child seats appropriate for their age and size.

5. Mobile Phones: The use of handheld mobile phones while driving is strictly prohibited. It is only permitted to use hands-free devices, provided they do not distract the driver.

6. Overtaking: Overtake on the left side and return to the right lane after passing. It is generally not allowed to overtake on the right, except in specific situations or when the vehicle ahead is turning left.

7. Alcohol and Drugs: Driving under the influence of alcohol or drugs is illegal and strictly enforced. The legal blood alcohol concentration (BAC) limit is 0.05%, but it is advisable to avoid any alcohol consumption before driving.

8. Parking: Observe parking regulations and signage when parking your vehicle. Avoid parking in designated no-parking zones or blocking access for other vehicles or pedestrians.

9. Pedestrians: Give priority to pedestrians at crosswalks and intersections. Be cautious and yield to pedestrians crossing the road.

10. Winter Tires: In winter conditions, it is mandatory to use winter tires (with the M+S or snowflake symbol) or all-season tires that are suitable for snowy and icy road conditions. The use of summer tires is not permitted during winter months.

11. Emergency Vehicles: When emergency vehicles with flashing lights or sirens approach, yield the right-of-way and make way for them to pass. Move to the right and stop if necessary.

These are some general traffic rules in Germany, but it's important to familiarize yourself with the specific rules and regulations of the region you are driving in, as they may vary. Additionally, always drive responsibly, adapt to road conditions, and prioritize safety."
Transportation,Are there toll roads in Germany?,"Yes, there are toll roads in Germany, but the toll system is primarily applicable to heavy vehicles (trucks and buses) rather than private cars. Here are the key points about toll roads in Germany:

1. Autobahn Tolls: Private cars are generally not subject to tolls on the autobahn (freeways) in Germany. However, there are specific sections of some autobahns, such as tunnels or bridges, where tolls may be applicable. These tolls are typically collected through toll booths or electronic toll collection systems.

2. Heavy Vehicle Toll (LKW-Maut): Heavy vehicles with a gross vehicle weight of over 3.5 tons are subject to a toll known as the Heavy Vehicle Toll or LKW-Maut. This toll applies to trucks, buses, and certain types of trailers. The toll amount is calculated based on factors such as distance traveled, the number of axles, and the vehicle's emission category.

3. Toll Payment Methods: The Heavy Vehicle Toll can be paid through various methods, including electronic toll collection systems such as Toll Collect. This system uses onboard units (OBU) installed in vehicles to track toll usage and deduct the toll charges automatically.

4. Toll Exemptions: Some vehicles and specific situations may be exempt from tolls. For example, emergency vehicles, certain agricultural vehicles, and vehicles used for public services may be exempt. It's advisable to check the official regulations or consult with relevant authorities for detailed information on toll exemptions.

5. Road Vignettes: Unlike some neighboring countries, Germany does not require road vignettes or stickers for private cars to use the roads. However, there are countries, such as Austria and Switzerland, that require vignettes if you plan to travel from Germany to these countries.

It's important to note that toll regulations and requirements may change over time. If you are planning to travel in Germany and want to confirm the latest information regarding tolls, it's advisable to check official sources or consult with relevant authorities."
